{"generated_at":"2026-10-11T04:03:21Z","lp_text":"\\ Supply Chain Orchestra MILP (generated); layout in model.json\nMinimize\n obj: 32260000 z0 + 31060000 z1 + 24120000 z2 + 24620000 z3 + 23240000 z4 + 18440000 z5 + 18120000 z6 + 21780000 z7 + 22100000 z8 + 18580000 z9 + 18880000 z10 + 19700000 z11 + 16780000 z12 + 16220000 z13 + 9 x0_0 + 22 x0_1 + 14 x0_2 + 232.3 x1_0 + 404.8 x1_1 + 173.5 x1_2 + 310.525 x2_0 + 538.9 x2_1 + 229.375 x2_2 + 359.49 x3_0 + 622.84 x3_1 + 264.35 x3_2 + 409.155 x4_0 + 707.98 x4_1 + 299.825 x4_2 + 9 x5_0 + 22 x5_1 + 14 x5_2 + 161.88 x6_0 + 284.08 x6_1 + 123.2 x6_2 + 161.95 x7_0 + 284.2 x7_1 + 123.25 x7_2 + 307.305 x8_0 + 533.38 x8_1 + 227.075 x8_2 + 363.935 x9_0 + 630.46 x9_1 + 267.525 x9_2 + 9 x10_0 + 22 x10_1 + 14 x10_2 + 191.49 x11_0 + 334.84 x11_1 + 144.35 x11_2 + 210.985 x12_0 + 368.26 x12_1 + 158.275 x12_2 + 256.24 x13_0 + 445.84 x13_1 + 190.6 x13_2 + 298.135 x14_0 + 517.66 x14_1 + 220.525 x14_2 + 9 x15_0 + 22 x15_1 + 14 x15_2 + 181.83 x16_0 + 318.28 x16_1 + 137.45 x16_2 + 212.595 x17_0 + 371.02 x17_1 + 159.425 x17_2 + 290.505 x18_0 + 504.58 x18_1 + 215.075 x18_2 + 342.48 x19_0 + 593.68 x19_1 + 252.2 x19_2 + 9 x20_0 + 22 x20_1 + 14 x20_2 + 155.93 x21_0 + 273.88 x21_1 + 118.95 x21_2 + 161.95 x22_0 + 284.2 x22_1 + 123.25 x22_2 + 254.63 x23_0 + 443.08 x23_1 + 189.45 x23_2 + 293.55 x24_0 + 509.8 x24_1 + 217.25 x24_2 + 41.515 x25_0 + 77.74 x25_1 + 37.225 x25_2 + 200.135 x26_0 + 349.66 x26_1 + 150.525 x26_2 + 289 x27_0 + 502 x27_1 + 214 x27_2 + 329.355 x28_0 + 571.18 x28_1 + 242.825 x28_2 + 378.11 x29_0 + 654.76 x29_1 + 277.65 x29_2 + 88.66 x30_0 + 158.56 x30_1 + 70.9 x30_2 + 185.085 x31_0 + 323.86 x31_1 + 139.775 x31_2 + 218.125 x32_0 + 380.5 x32_1 + 163.375 x32_2 + 275.14 x33_0 + 478.24 x33_1 + 204.1 x33_2 + 344.055 x34_0 + 596.38 x34_1 + 253.325 x34_2 + 55.55 x35_0 + 101.8 x35_1 + 47.25 x35_2 + 133.04 x36_0 + 234.64 x36_1 + 102.6 x36_2 + 208.43 x37_0 + 363.88 x37_1 + 156.45 x37_2 + 272.515 x38_0 + 473.74 x38_1 + 202.225 x38_2 + 358.335 x39_0 + 620.86 x39_1 + 263.525 x39_2 + 88.625 x40_0 + 158.5 x40_1 + 70.875 x40_2 + 102.73 x41_0 + 182.68 x41_1 + 80.95 x41_2 + 185.855 x42_0 + 325.18 x42_1 + 140.325 x42_2 + 247.49 x43_0 + 430.84 x43_1 + 184.35 x43_2 + 255.365 x44_0 + 444.34 x44_1 + 189.975 x44_2 + 87.015 x45_0 + 155.74 x45_1 + 69.725 x45_2 + 108.61 x46_0 + 192.76 x46_1 + 85.15 x46_2 + 199.015 x47_0 + 347.74 x47_1 + 149.725 x47_2 + 233.315 x48_0 + 406.54 x48_1 + 174.225 x48_2 + 256.94 x49_0 + 447.04 x49_1 + 191.1 x49_2 + 9 x50_0 + 22 x50_1 + 14 x50_2 + 151.87 x51_0 + 266.92 x51_1 + 116.05 x51_2 + 254.455 x52_0 + 442.78 x52_1 + 189.325 x52_2 + 353.925 x53_0 + 613.3 x53_1 + 260.375 x53_2 + 359.49 x54_0 + 622.84 x54_1 + 264.35 x54_2 + 70.25 x55_0 + 127 x55_1 + 57.75 x55_2 + 159.115 x56_0 + 279.34 x56_1 + 121.225 x56_2 + 229.255 x57_0 + 399.58 x57_1 + 171.325 x57_2 + 244.725 x58_0 + 426.1 x58_1 + 182.375 x58_2 + 329.705 x59_0 + 571.78 x59_1 + 243.075 x59_2 + 39.695 x60_0 + 74.62 x60_1 + 35.925 x60_2 + 133.39 x61_0 + 235.24 x61_1 + 102.85 x61_2 + 262.89 x62_0 + 457.24 x62_1 + 195.35 x62_2 + 308.81 x63_0 + 535.96 x63_1 + 228.15 x63_2 + 399.39 x64_0 + 691.24 x64_1 + 292.85 x64_2 + 9 x65_0 + 22 x65_1 + 14 x65_2 + 151.87 x66_0 + 266.92 x66_1 + 116.05 x66_2 + 225.72 x67_0 + 393.52 x67_1 + 168.8 x67_2 + 232.3 x68_0 + 404.8 x68_1 + 173.5 x68_2 + 256.24 x69_0 + 445.84 x69_1 + 190.6 x69_2 + 125.2 x70_0 + 221.2 x70_1 + 97 x70_2 + 156.245 x71_0 + 274.42 x71_1 + 119.175 x71_2 + 210.005 x72_0 + 366.58 x72_1 + 157.575 x72_2 + 223.025 x73_0 + 388.9 x73_1 + 166.875 x73_2 + 290.82 x74_0 + 505.12 x74_1 + 215.3 x74_2 + 9 x75_0 + 22 x75_1 + 14 x75_2 + 161.88 x76_0 + 284.08 x76_1 + 123.2 x76_2 + 293.55 x77_0 + 509.8 x77_1 + 217.25 x77_2 + 296.42 x78_0 + 514.72 x78_1 + 219.3 x78_2 + 423.33 x79_0 + 732.28 x79_1 + 309.95 x79_2 + 9 x80_0 + 22 x80_1 + 14 x80_2 + 296.42 x81_0 + 514.72 x81_1 + 219.3 x81_2 + 412.9 x82_0 + 714.4 x82_1 + 302.5 x82_2 + 439.22 x83_0 + 759.52 x83_1 + 321.3 x83_2 + 474.22 x84_0 + 819.52 x84_1 + 346.3 x84_2 + 9 x85_0 + 22 x85_1 + 14 x85_2 + 208.43 x86_0 + 363.88 x86_1 + 156.45 x86_2 + 219.14 x87_0 + 382.24 x87_1 + 164.1 x87_2 + 241.54 x88_0 + 420.64 x88_1 + 180.1 x88_2 + 254.63 x89_0 + 443.08 x89_1 + 189.45 x89_2 + 9 x90_0 + 22 x90_1 + 14 x90_2 + 180.465 x91_0 + 315.94 x91_1 + 136.475 x91_2 + 181.83 x92_0 + 318.28 x92_1 + 137.45 x92_2 + 187.99 x93_0 + 328.84 x93_1 + 141.85 x93_2 + 219.14 x94_0 + 382.24 x94_1 + 164.1 x94_2 + 9 x95_0 + 22 x95_1 + 14 x95_2 + 155.93 x96_0 + 273.88 x96_1 + 118.95 x96_2 + 241.54 x97_0 + 420.64 x97_1 + 180.1 x97_2 + 248.505 x98_0 + 432.58 x98_1 + 185.075 x98_2 + 290.505 x99_0 + 504.58 x99_1 + 215.075 x99_2 + 107.525 x100_0 + 190.9 x100_1 + 84.375 x100_2 + 117.01 x101_0 + 207.16 x101_1 + 91.15 x101_2 + 194.15 x102_0 + 339.4 x102_1 + 146.25 x102_2 + 256.45 x103_0 + 446.2 x103_1 + 190.75 x103_2 + 267.37 x104_0 + 464.92 x104_1 + 198.55 x104_2 + 88.94 x105_0 + 159.04 x105_1 + 71.1 x105_2 + 312.065 x106_0 + 541.54 x106_1 + 230.475 x106_2 + 367.75 x107_0 + 637 x107_1 + 270.25 x107_2 + 436.21 x108_0 + 754.36 x108_1 + 319.15 x108_2 + 485.175 x109_0 + 838.3 x109_1 + 354.125 x109_2 + 108.925 x110_0 + 193.3 x110_1 + 85.375 x110_2 + 214.135 x111_0 + 373.66 x111_1 + 160.525 x111_2 + 223.41 x112_0 + 389.56 x112_1 + 167.15 x112_2 + 270.905 x113_0 + 470.98 x113_1 + 201.075 x113_2 + 290.75 x114_0 + 505 x114_1 + 215.25 x114_2 + 69.725 x115_0 + 126.1 x115_1 + 57.375 x115_2 + 235.8 x116_0 + 410.8 x116_1 + 176 x116_2 + 356.2 x117_0 + 617.2 x117_1 + 262 x117_2 + 422.49 x118_0 + 730.84 x118_1 + 309.35 x118_2 + 428.16 x119_0 + 740.56 x119_1 + 313.4 x119_2 + 9 x120_0 + 22 x120_1 + 14 x120_2 + 187.99 x121_0 + 328.84 x121_1 + 141.85 x121_2 + 210.985 x122_0 + 368.26 x122_1 + 158.275 x122_2 + 212.595 x123_0 + 371.02 x123_1 + 159.425 x123_2 + 225.72 x124_0 + 393.52 x124_1 + 168.8 x124_2 + 80.365 x125_0 + 144.34 x125_1 + 64.975 x125_2 + 162.58 x126_0 + 285.28 x126_1 + 123.7 x126_2 + 263.765 x127_0 + 458.74 x127_1 + 195.975 x127_2 + 295.475 x128_0 + 513.1 x128_1 + 218.625 x128_2 + 340.415 x129_0 + 590.14 x129_1 + 250.725 x129_2 + 45.085 x130_0 + 83.86 x130_1 + 39.775 x130_2 + 190.58 x131_0 + 333.28 x131_1 + 143.7 x131_2 + 244.165 x132_0 + 425.14 x132_1 + 181.975 x132_2 + 287.6 x133_0 + 499.6 x133_1 + 213 x133_2 + 316.16 x134_0 + 548.56 x134_1 + 233.4 x134_2 + 103.675 x135_0 + 184.3 x135_1 + 81.625 x135_2 + 146.795 x136_0 + 258.22 x136_1 + 112.425 x136_2 + 150.12 x137_0 + 263.92 x137_1 + 114.8 x137_2 + 225.51 x138_0 + 393.16 x138_1 + 168.65 x138_2 + 291.73 x139_0 + 506.68 x139_1 + 215.95 x139_2 + 88.625 x140_0 + 158.5 x140_1 + 70.875 x140_2 + 95.625 x141_0 + 170.5 x141_1 + 75.875 x141_2 + 214.065 x142_0 + 373.54 x142_1 + 160.475 x142_2 + 328.2 x143_0 + 569.2 x143_1 + 242 x143_2 + 359.175 x144_0 + 622.3 x144_1 + 264.125 x144_2 + 59.785 x145_0 + 109.06 x145_1 + 50.275 x145_2 + 118.62 x146_0 + 209.92 x146_1 + 92.3 x146_2 + 200.1 x147_0 + 349.6 x147_1 + 150.5 x147_2 + 270.66 x148_0 + 470.56 x148_1 + 200.9 x148_2 + 340.065 x149_0 + 589.54 x149_1 + 250.475 x149_2 + 52.225 x150_0 + 96.1 x150_1 + 44.875 x150_2 + 159.08 x151_0 + 279.28 x151_1 + 121.2 x151_2 + 272.235 x152_0 + 473.26 x152_1 + 202.025 x152_2 + 272.34 x153_0 + 473.44 x153_1 + 202.1 x153_2 + 383.255 x154_0 + 663.58 x154_1 + 281.325 x154_2 + 104.62 x155_0 + 185.92 x155_1 + 82.3 x155_2 + 129.4 x156_0 + 228.4 x156_1 + 100 x156_2 + 147.355 x157_0 + 259.18 x157_1 + 112.825 x157_2 + 254.91 x158_0 + 443.56 x158_1 + 189.65 x158_2 + 302.93 x159_0 + 525.88 x159_1 + 223.95 x159_2 + 79.49 x160_0 + 142.84 x160_1 + 64.35 x160_2 + 135.28 x161_0 + 238.48 x161_1 + 104.2 x161_2 + 166.5 x162_0 + 292 x162_1 + 126.5 x162_2 + 179.695 x163_0 + 314.62 x163_1 + 135.925 x163_2 + 241.12 x164_0 + 419.92 x164_1 + 179.8 x164_2 + 19.36 x165_0 + 39.76 x165_1 + 21.4 x165_2 + 145.78 x166_0 + 256.48 x166_1 + 111.7 x166_2 + 171.575 x167_0 + 300.7 x167_1 + 130.125 x167_2 + 252.67 x168_0 + 439.72 x168_1 + 188.05 x168_2 + 303.91 x169_0 + 527.56 x169_1 + 224.65 x169_2 + 63.81 x170_0 + 115.96 x170_1 + 53.15 x170_2 + 184.56 x171_0 + 322.96 x171_1 + 139.4 x171_2 + 185.4 x172_0 + 324.4 x172_1 + 140 x172_2 + 277.38 x173_0 + 482.08 x173_1 + 205.7 x173_2 + 277.415 x174_0 + 482.14 x174_1 + 205.725 x174_2 + 35.11 x175_0 + 66.76 x175_1 + 32.65 x175_2 + 203.39 x176_0 + 355.24 x176_1 + 152.85 x176_2 + 214.345 x177_0 + 374.02 x177_1 + 160.675 x177_2 + 216.48 x178_0 + 377.68 x178_1 + 162.2 x178_2 + 239.195 x179_0 + 416.62 x179_1 + 178.425 x179_2 + 146.48 x180_0 + 257.68 x180_1 + 112.2 x180_2 + 283.19 x181_0 + 492.04 x181_1 + 209.85 x181_2 + 373.28 x182_0 + 646.48 x182_1 + 274.2 x182_2 + 415.385 x183_0 + 718.66 x183_1 + 304.275 x183_2 + 466.73 x184_0 + 806.68 x184_1 + 340.95 x184_2 + 9 x185_0 + 22 x185_1 + 14 x185_2 + 180.465 x186_0 + 315.94 x186_1 + 136.475 x186_2 + 191.49 x187_0 + 334.84 x187_1 + 144.35 x187_2 + 208.43 x188_0 + 363.88 x188_1 + 156.45 x188_2 + 235.1 x189_0 + 409.6 x189_1 + 175.5 x189_2 + 130.59 x190_0 + 230.44 x190_1 + 100.85 x190_2 + 131.22 x191_0 + 231.52 x191_1 + 101.3 x191_2 + 240.245 x192_0 + 418.42 x192_1 + 179.175 x192_2 + 308.705 x193_0 + 535.78 x193_1 + 228.075 x193_2 + 339.75 x194_0 + 589 x194_1 + 250.25 x194_2 + 18.065 x195_0 + 37.54 x195_1 + 20.475 x195_2 + 155.895 x196_0 + 273.82 x196_1 + 118.925 x196_2 + 170.945 x197_0 + 299.62 x197_1 + 129.675 x197_2 + 300.515 x198_0 + 521.74 x198_1 + 222.225 x198_2 + 362.745 x199_0 + 628.42 x199_1 + 266.675 x199_2 + 27.55 x200_0 + 53.8 x200_1 + 27.25 x200_2 + 150.015 x201_0 + 263.74 x201_1 + 114.725 x201_2 + 276.995 x202_0 + 481.42 x202_1 + 205.425 x202_2 + 294.845 x203_0 + 512.02 x203_1 + 218.175 x203_2 + 405.06 x204_0 + 700.96 x204_1 + 296.9 x204_2 + 131.5 x205_0 + 232 x205_1 + 101.5 x205_2 + 157.575 x206_0 + 276.7 x206_1 + 120.125 x206_2 + 299.745 x207_0 + 520.42 x207_1 + 221.675 x207_2 + 300.095 x208_0 + 521.02 x208_1 + 221.925 x208_2 + 304.155 x209_0 + 527.98 x209_1 + 224.825 x209_2 + 50.51 x210_0 + 93.16 x210_1 + 43.65 x210_2 + 124.815 x211_0 + 220.54 x211_1 + 96.725 x211_2 + 183.055 x212_0 + 320.38 x212_1 + 138.325 x212_2